{
  "schema_version": 1,
  "registry_version": 29,
  "effective_date": "2026-06-19",
  "source_sha256": "e99cd70eb64ca854acb6420ebbf06e369e3f258e0cfba4f03f70bd881386f79b",
  "profiles": [
    "traditional",
    "commander_duel",
    "commander_review"
  ],
  "aggregates": [
    {
      "mechanic_id": "cr-121-drawing-a-card",
      "capabilities": [
        "zone.draw.library_to_hand"
      ]
    },
    {
      "mechanic_id": "cr-120-damage",
      "capabilities": [
        "damage.amount.positive",
        "damage.combat.excess",
        "damage.prevention.order",
        "damage.prevention.static_fixed",
        "damage.replacement.order",
        "damage.replacement.static_quantity",
        "damage.result.battle_defense",
        "damage.result.creature_mark",
        "damage.result.infect",
        "damage.result.lifelink",
        "damage.result.multitype_permanent",
        "damage.result.planeswalker_loyalty",
        "damage.result.player_life",
        "damage.result.replacement_order",
        "damage.result.toxic",
        "damage.result.wither",
        "life.gain.replacement.static_multiplier",
        "damage.trigger.noncombat"
      ]
    },
    {
      "mechanic_id": "cr-725-the-monarch",
      "capabilities": [
        "variant.monarch.designate"
      ]
    },
    {
      "mechanic_id": "cr-903-commander",
      "capabilities": [
        "format.commander.damage.physical_identity"
      ]
    },
    {
      "mechanic_id": "cr-111-tokens",
      "capabilities": [
        "token.creation.additional_replacement"
      ]
    },
    {
      "mechanic_id": "cr-614-replacement-effects",
      "capabilities": [
        "zone.change.destination_replacement"
      ]
    },
    {
      "mechanic_id": "cr-613-continuous-effects",
      "capabilities": [
        "continuous.attached.fixed_characteristics",
        "continuous.basic_land_type.add_all_lands",
        "continuous.power_toughness.fixed_anthem"
      ]
    },
    {
      "mechanic_id": "tap-and-untap",
      "capabilities": [
        "permanent.tap.effect",
        "permanent.untap.effect",
        "permanent.untap.all_creatures"
      ]
    }
  ],
  "capabilities": [
    {
      "id": "attachment.aura.simple_object",
      "version": 1,
      "official_rules": ["303.4", "303.4a", "303.4c", "303.4f", "303.4g", "608.2b", "701.3", "702.5a", "704.5m"],
      "supported_profiles": ["traditional", "commander_duel", "commander_review"],
      "applicability": {
        "summary": "Cast, resolve, enter, and continuously validate an Aura with exactly one closed battlefield-object Enchant restriction and an optional you-control or opponent-controls relation.",
        "inputs": ["Aura card with one simple Enchant keyword line", "one public battlefield object target", "exact physical and logical source identity", "optional controller relation", "nonspell Aura entry choice"],
        "outputs": ["mandatory cast target", "resolution-time target revalidation", "reciprocal live attachment", "seat-scoped nonspell entry choice", "no-target remain-or-graveyard result", "Aura-token preflight and no-creation result", "state-based illegal-Aura result"],
        "exclusions": ["Auras enchanting players", "Auras enchanting cards outside the battlefield", "multiple Enchant abilities", "quality, color, subtype, state, and compound Enchant restrictions", "bestow, reconfigure, and face-up attachment", "protection qualities beyond represented everything, Aura, enchantment, and color protection"]
      },
      "dependencies": ["target.revalidate_resolution"],
      "implementation_components": ["mtg_commander_sim.aura.grammar.parse_simple_enchant_line", "mtg_commander_sim.aura.runtime.prepare_aura_entry", "mtg_commander_sim.aura.runtime.simple_aura_attachment_is_legal", "mtg_commander_sim.rules.casting.proposal._aura_spell_target_schema", "mtg_commander_sim.token_creation._preflight_aura_token_specs", "mtg_commander_sim.attachments.attach_objects"],
      "positive_tests": ["test_aura_offer_requires_and_projects_one_legal_spell_target", "test_spell_resolution_attaches_and_illegal_target_counters_by_rule", "test_aura_tokens_preflight_attachment_and_no_legal_object_is_not_created"],
      "negative_tests": ["test_unsupported_enchant_grammar_fails_before_mutation", "test_nonspell_entry_with_no_legal_object_stays_in_origin_zone"],
      "interaction_tests": ["test_nonspell_entry_pauses_for_choice_and_resumes_exact_effect", "test_control_relation_and_protection_are_live_attachment_legality"],
      "multiplayer_tests": ["test_four_player_aura_targets_and_relations_are_seat_correct"],
      "privacy_tests": ["test_aura_entry_choice_projection_and_replay_are_exact"],
      "replay_tests": ["test_aura_entry_choice_projection_and_replay_are_exact"],
      "required_evidence": ["positive", "negative", "interaction", "multiplayer", "privacy", "replay"],
      "dependency_fail_closed_status": "passed",
      "dependency_fail_closed_rationale": "The bounded Aura path is unavailable if public target validation or resolution revalidation is not trusted, and unsupported Enchant grammar fails before mutation.",
      "implementation_mutation_status": "killed",
      "implementation_mutation_rationale": "test_aura_cast_targeting_mutant_is_killed removes the Aura target-schema lowering and mandatory-target assertions reject the survivor.",
      "blockers": [],
      "status": "trusted"
    },
    {
      "id": "attachment.equip.fixed_mana",
      "version": 1,
      "official_rules": ["301.5", "602.1", "602.2", "608.2b", "608.2h", "701.3", "702.6a", "702.6b"],
      "supported_profiles": ["traditional", "commander_duel", "commander_review"],
      "applicability": {
        "summary": "Activate an Equipment's printed Equip ability with a fixed ordinary mana cost at sorcery speed, target a creature its controller controls, and attach the live Equipment on resolution.",
        "inputs": ["phased-in battlefield Equipment", "fixed numeric and colored mana cost", "active-player sorcery timing", "one target creature controlled by the activator"],
        "outputs": ["payable activated-ability offer", "public target contract", "stack object", "live reciprocal attachment relation", "new attachment timestamp when the relation changes"],
        "exclusions": ["Equip costs containing X, hybrid, Phyrexian, snow, or nonmana costs", "Equip variants with different target restrictions", "instant-speed Equip permissions", "Equipment controlled by another player", "attachment legality beyond creature control and represented protection", "static characteristics granted by the Equipment"]
      },
      "dependencies": [],
      "implementation_components": ["mtg_commander_sim.abilities.parse_activated_abilities", "mtg_commander_sim.rules.activation.resolution.builtin_activation_resolution", "mtg_commander_sim.effect_runtime.zones_and_attachments._apply_attach", "mtg_commander_sim.attachments.attach_objects"],
      "positive_tests": ["test_fixed_equip_parser_exposes_only_executable_target_contract", "test_generic_fixed_equip_activation_attaches_and_applies_characteristics"],
      "negative_tests": ["test_fixed_equip_keyword_has_exact_bounded_capability", "test_equip_resolves_without_effect_after_equipment_leaves"],
      "interaction_tests": ["test_live_generic_equipment_effect_moves_detaches_and_tracks_control", "test_generic_fixed_equip_activation_attaches_and_applies_characteristics"],
      "multiplayer_tests": ["test_multiple_sources_apply_independently_in_four_player_game"],
      "privacy_tests": ["test_projection_hides_relation_identity_and_replay_is_exact"],
      "replay_tests": ["test_projection_hides_relation_identity_and_replay_is_exact"],
      "required_evidence": ["positive", "negative", "interaction", "multiplayer", "privacy", "replay"],
      "dependency_fail_closed_status": "not_applicable",
      "dependency_fail_closed_rationale": "This bounded intrinsic keyword ability owns its cost, timing, target, stack, and attachment commit without another optional capability.",
      "implementation_mutation_status": "killed",
      "implementation_mutation_rationale": "test_generic_equip_resolution_mutant_is_killed removes recognition of the typed built-in Equip resolution and the exact attach operation assertion rejects the survivor.",
      "blockers": [],
      "status": "trusted"
    },
    {
      "id": "protection.typed.debt",
      "version": 1,
      "official_rules": ["301.5c", "303.4c", "509.1b", "702.16", "702.16a", "702.16b", "702.16c", "702.16d", "702.16e", "702.16f", "702.16j"],
      "supported_profiles": ["traditional", "commander_duel", "commander_review"],
      "applicability": {
        "summary": "Apply the damage, enchanting/equipping/fortifying, blocking, and targeting prohibitions of one compiled protection quality using live or last-known source characteristics.",
        "inputs": ["trusted typed protection fragment", "protected permanent characteristics", "source colors, card types, and subtypes", "target, attachment, block, or damage event"],
        "outputs": ["closed allowed, blocked, or unresolved verdict", "protection prevention effect", "target and declaration filtering", "illegal-attachment state action"],
        "exclusions": ["protection quality conjunctions and comma lists", "qualities other than everything, colors, represented card types, and Aura", "effects that remove protection from damage", "effects that redefine a quality dynamically", "untrusted or text-only granted protection"]
      },
      "dependencies": ["attachment.aura.simple_object", "damage.prevention.static_fixed", "target.revalidate_resolution"],